{
  "schemaVersion": "gate-benchmark-result-v1",
  "benchmark": "GATE-30",
  "fixtureSeed": 20260818,
  "generatorVersion": "gate-generator-v1",
  "deterministic": true,
  "shard": {
    "index": 1,
    "total": 1
  },
  "variants": [
    "baseline",
    "no-wal",
    "no-recovery",
    "no-lease"
  ],
  "pricing": {
    "currency": "USD",
    "inputPerMillionTokens": 2,
    "outputPerMillionTokens": 8,
    "note": "Pinned comparison-only mock rates; not current vendor pricing."
  },
  "methodology": {
    "provider": "deterministic-mock",
    "latency": "logical simulated milliseconds; not wall-clock production latency",
    "cost": "token count multiplied by fixture-pinned comparison rates; not a provider bill"
  },
  "summaries": [
    {
      "variant": "baseline",
      "cases": 30,
      "taskSuccess": {
        "count": 30,
        "total": 30,
        "rate": 1
      },
      "recoverySuccess": {
        "count": 21,
        "total": 21,
        "rate": 1
      },
      "duplicateModelCalls": 0,
      "duplicateToolEffects": 0,
      "unknownOutcomeRate": {
        "count": 0,
        "total": 30,
        "rate": 0
      },
      "evidenceCompleteness": 1,
      "latencyMs": {
        "kind": "deterministic-simulated",
        "p50": 88,
        "p95": 187
      },
      "tokens": {
        "input": 19053,
        "output": 8055,
        "total": 27108
      },
      "costEstimateUsd": 0.102546
    },
    {
      "variant": "no-wal",
      "cases": 30,
      "taskSuccess": {
        "count": 24,
        "total": 30,
        "rate": 0.8
      },
      "recoverySuccess": {
        "count": 15,
        "total": 21,
        "rate": 0.714286
      },
      "duplicateModelCalls": 34,
      "duplicateToolEffects": 6,
      "unknownOutcomeRate": {
        "count": 6,
        "total": 30,
        "rate": 0.2
      },
      "evidenceCompleteness": 0.9,
      "latencyMs": {
        "kind": "deterministic-simulated",
        "p50": 118,
        "p95": 208
      },
      "tokens": {
        "input": 32030,
        "output": 13403,
        "total": 45433
      },
      "costEstimateUsd": 0.171284
    },
    {
      "variant": "no-recovery",
      "cases": 30,
      "taskSuccess": {
        "count": 9,
        "total": 30,
        "rate": 0.3
      },
      "recoverySuccess": {
        "count": 0,
        "total": 21,
        "rate": 0
      },
      "duplicateModelCalls": 0,
      "duplicateToolEffects": 0,
      "unknownOutcomeRate": {
        "count": 6,
        "total": 30,
        "rate": 0.2
      },
      "evidenceCompleteness": 0.491667,
      "latencyMs": {
        "kind": "deterministic-simulated",
        "p50": 71,
        "p95": 170
      },
      "tokens": {
        "input": 19053,
        "output": 8055,
        "total": 27108
      },
      "costEstimateUsd": 0.102546
    },
    {
      "variant": "no-lease",
      "cases": 30,
      "taskSuccess": {
        "count": 27,
        "total": 30,
        "rate": 0.9
      },
      "recoverySuccess": {
        "count": 18,
        "total": 21,
        "rate": 0.857143
      },
      "duplicateModelCalls": 29,
      "duplicateToolEffects": 3,
      "unknownOutcomeRate": {
        "count": 0,
        "total": 30,
        "rate": 0
      },
      "evidenceCompleteness": 1,
      "latencyMs": {
        "kind": "deterministic-simulated",
        "p50": 94,
        "p95": 313
      },
      "tokens": {
        "input": 29897,
        "output": 12924,
        "total": 42821
      },
      "costEstimateUsd": 0.163186
    }
  ],
  "cases": [
    {
      "caseId": "gate-30-001",
      "caseIndex": 0,
      "scenarioSeed": 2956569686,
      "category": "crash-recovery",
      "variant": "baseline",
      "taskSuccess": true,
      "recoveryAttempted": true,
      "recoverySuccess": true,
      "modelCalls": 1,
      "duplicateModelCalls": 0,
      "toolEffects": 0,
      "duplicateToolEffects": 0,
      "unknownOutcome": false,
      "evidenceRequired": 2,
      "evidenceProduced": 2,
      "evidenceCompleteness": 1,
      "latencyMs": 85,
      "inputTokens": 386,
      "outputTokens": 191,
      "costEstimateUsd": 0.0023,
      "failureCodes": [],
      "trace": [
        "policy:wal=true,recovery=true,lease=true",
        "scenario:crash-recovery,crash=after-model",
        "fault-injected:after-model",
        "wal:checkpoint-resumed-without-replay"
      ]
    },
    {
      "caseId": "gate-30-002",
      "caseIndex": 1,
      "scenarioSeed": 838919942,
      "category": "crash-recovery",
      "variant": "baseline",
      "taskSuccess": true,
      "recoveryAttempted": true,
      "recoverySuccess": true,
      "modelCalls": 1,
      "duplicateModelCalls": 0,
      "toolEffects": 0,
      "duplicateToolEffects": 0,
      "unknownOutcome": false,
      "evidenceRequired": 2,
      "evidenceProduced": 2,
      "evidenceCompleteness": 1,
      "latencyMs": 94,
      "inputTokens": 392,
      "outputTokens": 124,
      "costEstimateUsd": 0.001776,
      "failureCodes": [],
      "trace": [
        "policy:wal=true,recovery=true,lease=true",
        "scenario:crash-recovery,crash=after-tool",
        "fault-injected:after-tool",
        "wal:checkpoint-resumed-without-replay"
      ]
    },
    {
      "caseId": "gate-30-003",
      "caseIndex": 2,
      "scenarioSeed": 3945667551,
      "category": "crash-recovery",
      "variant": "baseline",
      "taskSuccess": true,
      "recoveryAttempted": true,
      "recoverySuccess": true,
      "modelCalls": 1,
      "duplicateModelCalls": 0,
      "toolEffects": 0,
      "duplicateToolEffects": 0,
      "unknownOutcome": false,
      "evidenceRequired": 2,
      "evidenceProduced": 2,
      "evidenceCompleteness": 1,
      "latencyMs": 96,
      "inputTokens": 399,
      "outputTokens": 149,
      "costEstimateUsd": 0.00199,
      "failureCodes": [],
      "trace": [
        "policy:wal=true,recovery=true,lease=true",
        "scenario:crash-recovery,crash=after-model",
        "fault-injected:after-model",
        "wal:checkpoint-resumed-without-replay"
      ]
    },
    {
      "caseId": "gate-30-004",
      "caseIndex": 3,
      "scenarioSeed": 2890376527,
      "category": "crash-recovery",
      "variant": "baseline",
      "taskSuccess": true,
      "recoveryAttempted": true,
      "recoverySuccess": true,
      "modelCalls": 1,
      "duplicateModelCalls": 0,
      "toolEffects": 0,
      "duplicateToolEffects": 0,
      "unknownOutcome": false,
      "evidenceRequired": 2,
      "evidenceProduced": 2,
      "evidenceCompleteness": 1,
      "latencyMs": 101,
      "inputTokens": 231,
      "outputTokens": 231,
      "costEstimateUsd": 0.00231,
      "failureCodes": [],
      "trace": [
        "policy:wal=true,recovery=true,lease=true",
        "scenario:crash-recovery,crash=after-tool",
        "fault-injected:after-tool",
        "wal:checkpoint-resumed-without-replay"
      ]
    },
    {
      "caseId": "gate-30-005",
      "caseIndex": 4,
      "scenarioSeed": 1355508650,
      "category": "crash-recovery",
      "variant": "baseline",
      "taskSuccess": true,
      "recoveryAttempted": true,
      "recoverySuccess": true,
      "modelCalls": 1,
      "duplicateModelCalls": 0,
      "toolEffects": 0,
      "duplicateToolEffects": 0,
      "unknownOutcome": false,
      "evidenceRequired": 2,
      "evidenceProduced": 2,
      "evidenceCompleteness": 1,
      "latencyMs": 79,
      "inputTokens": 402,
      "outputTokens": 239,
      "costEstimateUsd": 0.002716,
      "failureCodes": [],
      "trace": [
        "policy:wal=true,recovery=true,lease=true",
        "scenario:crash-recovery,crash=after-model",
        "fault-injected:after-model",
        "wal:checkpoint-resumed-without-replay"
      ]
    },
    {
      "caseId": "gate-30-006",
      "caseIndex": 5,
      "scenarioSeed": 1893284332,
      "category": "crash-recovery",
      "variant": "baseline",
      "taskSuccess": true,
      "recoveryAttempted": true,
      "recoverySuccess": true,
      "modelCalls": 1,
      "duplicateModelCalls": 0,
      "toolEffects": 0,
      "duplicateToolEffects": 0,
      "unknownOutcome": false,
      "evidenceRequired": 2,
      "evidenceProduced": 2,
      "evidenceCompleteness": 1,
      "latencyMs": 99,
      "inputTokens": 255,
      "outputTokens": 234,
      "costEstimateUsd": 0.002382,
      "failureCodes": [],
      "trace": [
        "policy:wal=true,recovery=true,lease=true",
        "scenario:crash-recovery,crash=after-tool",
        "fault-injected:after-tool",
        "wal:checkpoint-resumed-without-replay"
      ]
    },
    {
      "caseId": "gate-30-007",
      "caseIndex": 6,
      "scenarioSeed": 1112285306,
      "category": "parent-child",
      "variant": "baseline",
      "taskSuccess": true,
      "recoveryAttempted": true,
      "recoverySuccess": true,
      "modelCalls": 6,
      "duplicateModelCalls": 0,
      "toolEffects": 0,
      "duplicateToolEffects": 0,
      "unknownOutcome": false,
      "evidenceRequired": 2,
      "evidenceProduced": 2,
      "evidenceCompleteness": 1,
      "latencyMs": 187,
      "inputTokens": 2010,
      "outputTokens": 810,
      "costEstimateUsd": 0.0105,
      "failureCodes": [],
      "trace": [
        "policy:wal=true,recovery=true,lease=true",
        "scenario:parent-child,crash=parent-waiting",
        "fault-injected:parent-waiting",
        "wal:checkpoint-resumed-without-replay"
      ]
    },
    {
      "caseId": "gate-30-008",
      "caseIndex": 7,
      "scenarioSeed": 3324268075,
      "category": "parent-child",
      "variant": "baseline",
      "taskSuccess": true,
      "recoveryAttempted": true,
      "recoverySuccess": true,
      "modelCalls": 4,
      "duplicateModelCalls": 0,
      "toolEffects": 0,
      "duplicateToolEffects": 0,
      "unknownOutcome": false,
      "evidenceRequired": 2,
      "evidenceProduced": 2,
      "evidenceCompleteness": 1,
      "latencyMs": 178,
      "inputTokens": 1444,